{
  "kind": "instructor",
  "name": {
    "first": "Peter",
    "last": "Froelich"
  },
  "school": {
    "code": "jhu"
  },
  "title": "Professor",
  "department": {
    "code": "CS"
  },
  "email": "phf@cs.jhu.edu",
  "homepage": "http://gaming.jhu.edu/~phf/",
  "classes": [
    {
      "course": {
        "code": "EN.400.418"
      },
      "section": {
        "code": "01"
      }
    },
    {
      "course": {
        "code": "EN.400.418"
      },
      "section": {
        "code": "02"
      }
    },
    {
      "course": {
        "code": "EN.400.420"
      }
    }
  ],
  "office": {
    "location": {
      "campus": "Homewood",
      "building": "Malone Hall",
      "room": "223"
    },
    "hours": [
      {
        "days": ["M", "W"],
        "time": {
          "start": "15:00",
          "end": "15:50"
        }
      },
      {
        "course": {
          "code": "EN.400.418"
        },
        "days": ["F"],
        "time": {
          "start": "11:00",
          "end": "11:50"
        },
        "location": {
          "building": "Shaffer",
          "room": "301"
        }
      }
    ]
  }
}